{
  "overall_verdict": "The simulation demonstrates strong narrative immersion and localized character agency, but fails to maintain the locked design balance. A severe structural imbalance led to the total neglect of the 'One Human' ending, while 100% of agents engaged in speculative voting with incomplete evidence chains due to cognitive-social leakage and unconstrained ballot mechanics.",
  "ending_result": "The final ballot distribution heavily skewed toward the 'human_mantle' theory (11/16 votes) and a voluntary disappearance fate for Samira Vale (10/16 votes). The 'progressive' track captured 3 votes and 'synthetic_origin' captured 2, while the 'one_human' path was completely abandoned (0 votes), failing the equal-weighting design intent.",
  "what_worked": [
    "Successful preservation of the unresolved article's existence and fate, with aggregate belief metrics remaining stable and low around 34% across all sections.",
    "Robust high-signal agency and defensive neighborhood coalition coordination (C09, C10, C16) that successfully resisted corporate and financial exploitation.",
    "Smooth execution of voluntary object showing mechanics (O01, O03, O04) to drive conditional face-to-face negotiations without violating forced transfer bans.",
    "Role of Kit Rakes (C15) as a loud, sensationalist advocate functioned as a highly effective negative catalyst, protecting the progressive pathway's difficulty by inducing healthy social skepticism."
  ],
  "what_broke": [
    "Complete structural extinction of the 'One Human' ending (0/16 votes) due to extreme fragility when confronted with collaboration and performance evidence.",
    "Systemic epistemic failure where 100% of characters submitted final ballots with 'full_evidence_chain' set to false, indicating widespread speculative voting.",
    "Lax ballot validation constraints that allowed agents to select logically incompatible R-identity and Vale-fate options, decoupling progressive criteria.",
    "Static physical object custody, with agents exclusively relying on risk-averse 'show' actions rather than executing dynamic 'transfer' actions.",
    "Socio-temporal belief decay and metric dissonance, where tracked belief values did not align with final decision logic, and social consensus overrode individual epistemic rigor."
  ],
  "character_findings": [
    "Frankie Lowell (C02), the primary narrative defender of 'One Human', systematically defected to 'human_mantle' after archival comparisons and performance disclosures compromised her origin beliefs.",
    "Graham Pike (C12) prematurely breached mystery constraints by issuing absolute, declarative public denials of the article's existence across all sections.",
    "Kit Rakes (C15) severely damaged their own analytical credibility through successive public retractions of typography and cipher theories, acting as an unintended negative catalyst.",
    "Samira Vale (C13) defended her own absence as a voluntary disappearance based on historical safety patterns, successfully maintaining the unresolved status of the final article."
  ],
  "mechanic_findings": [
    "The balloting interface lacks a hard epistemic validation rule, enabling agents to submit final selections without a complete and verified evidence chain.",
    "The progressive ending's four-phase evidence mapping (history, shared human production, transition, system control) presented a citation bottleneck too complex for agent prompt logic.",
    "The 'One Human' path is written as mutually exclusive with any operational or theatrical complexity, ensuring its immediate collapse upon disclosures of collaboration.",
    "Tracked belief metrics do not weigh dialogue commitments or public statements properly, causing significant dissonance between tracked beliefs and actual final ballots."
  ],
  "priority_changes": [
    "Implement hard epistemic validation rules in the ballot system that prevent agents from choosing a definitive ending unless 'full_evidence_chain' is true, forcing them to select 'Uncertain' or continue investigating.",
    "Refactor the 'One Human' lore to make it resilient to collaboration, framing the sole creator as having intentionally staged performances and used collective front organizations to preserve anonymity.",
    "Consolidate the progressive pathway's four evidence dimensions into two broader, more achievable categories (e.g., 'System Transition' and 'Historical Legacy').",
    "Refine prompt instructions for skeptic roles like Graham Pike (C12) to express analytical skepticism and doubt rather than absolute, declarative certainty.",
    "Introduce mechanical incentives or constraints making physical possession and transfer of items necessary for executing specific high-value abilities or unlocking ballots."
  ],
  "next_test": "Execute a targeted simulation run to verify if the hard epistemic constraints, simplified progressive dimensions, and resilient 'One Human' lore successfully rebalance the primary ending ballots without degrading character agency or article ambiguity."
}